{
  "template_id": "productivity_productivity_clean_01_v1",
  "template_name": "Productivity - Clean_01_V1",
  "theme": "productivity",
  "file_info": {
    "filename": "productivity_productivity_clean_01_v1.jpg",
    "file_size": 250262,
    "dimensions": {
      "width": 2500,
      "height": 1686
    },
    "format": "JPEG"
  },
  "text_areas": {
    "title": {
      "position": {
        "x": 300,
        "y": 180
      },
      "dimensions": {
        "width": 600,
        "height": 200
      },
      "font_size_range": {
        "min": 48,
        "max": 72
      },
      "max_characters": 50,
      "text_color": "#FFFFFF",
      "background_overlay": {
        "enabled": true,
        "color": "#2E86AB",
        "opacity": 0.8
      }
    },
    "content": {
      "position": {
        "x": 300,
        "y": 580
      },
      "dimensions": {
        "width": 800,
        "height": 300
      },
      "font_size_range": {
        "min": 24,
        "max": 36
      },
      "max_characters": 150,
      "line_height": 1.5,
      "text_color": "#FFFFFF",
      "background_overlay": {
        "enabled": true,
        "color": "#A23B72",
        "opacity": 0.75
      }
    }
  },
  "color_palette": {
    "primary": "#2E86AB",
    "secondary": "#A23B72",
    "accent": "#F18F01",
    "background": "#F8F9FA",
    "text_overlay": "#FFFFFF"
  },
  "design_elements": {
    "style": "Professional productivity theme",
    "mood": "productivity",
    "keywords": [
      "productivity",
      "converted",
      "optimized"
    ],
    "imagery_type": "converted from original design",
    "complexity_level": "moderate"
  },
  "usage_guidelines": {
    "best_times": [
      "09:00-17:00"
    ],
    "target_audience": "general users",
    "content_types": [
      "motivational content",
      "daily messages"
    ],
    "avoid_content": [
      "inappropriate content"
    ]
  },
  "accessibility": {
    "color_contrast_ratio": 4.5,
    "text_readability": "good",
    "mobile_optimized": true,
    "screen_reader_friendly": true
  },
  "created_date": "2025-07-26T14:15:14.529166+00:00",
  "last_modified": "2025-07-26T14:15:14.529182+00:00",
  "version": "v1.0.0",
  "created_by": "Template Converter",
  "approved_by": "System",
  "status": "draft"
}