{
  "template_id": "morning_energy_motivation_bright_01_v1",
  "template_name": "Morning Energy - Motivation_Bright_01_V1",
  "theme": "morning_energy",
  "file_info": {
    "filename": "morning_energy_motivation_bright_01_v1.png",
    "file_size": 322539,
    "dimensions": {
      "width": 2500,
      "height": 1686
    },
    "format": "PNG"
  },
  "text_areas": {
    "title": {
      "position": {
        "x": 200,
        "y": 150
      },
      "dimensions": {
        "width": 600,
        "height": 200
      },
      "font_size_range": {
        "min": 48,
        "max": 72
      },
      "max_characters": 50,
      "text_color": "#FFFFFF",
      "background_overlay": {
        "enabled": true,
        "color": "#FF6B35",
        "opacity": 0.8
      }
    },
    "content": {
      "position": {
        "x": 200,
        "y": 600
      },
      "dimensions": {
        "width": 800,
        "height": 300
      },
      "font_size_range": {
        "min": 24,
        "max": 36
      },
      "max_characters": 150,
      "line_height": 1.5,
      "text_color": "#FFFFFF",
      "background_overlay": {
        "enabled": true,
        "color": "#F7931E",
        "opacity": 0.75
      }
    }
  },
  "color_palette": {
    "primary": "#FF6B35",
    "secondary": "#F7931E",
    "accent": "#87CEEB",
    "background": "#F8F9FA",
    "text_overlay": "#FFFFFF"
  },
  "design_elements": {
    "style": "Energetic morning theme",
    "mood": "morning energy",
    "keywords": [
      "morning_energy",
      "converted",
      "optimized"
    ],
    "imagery_type": "converted from original design",
    "complexity_level": "moderate"
  },
  "usage_guidelines": {
    "best_times": [
      "06:00-10:00"
    ],
    "target_audience": "general users",
    "content_types": [
      "motivational content",
      "daily messages"
    ],
    "avoid_content": [
      "inappropriate content"
    ]
  },
  "accessibility": {
    "color_contrast_ratio": 4.5,
    "text_readability": "good",
    "mobile_optimized": true,
    "screen_reader_friendly": true
  },
  "created_date": "2025-07-26T14:14:54.395840+00:00",
  "last_modified": "2025-07-26T14:14:54.395862+00:00",
  "version": "v1.0.0",
  "created_by": "Template Converter",
  "approved_by": "System",
  "status": "draft"
}