{
  "template_id": "wellness_nature_v1",
  "template_name": "Wellness - Natural Balance",
  "theme": "wellness",
  "file_info": {
    "filename": "wellness_nature_v1.png",
    "file_size": 923000,
    "dimensions": {
      "width": 2500,
      "height": 1686
    },
    "format": "PNG"
  },
  "text_areas": {
    "title": {
      "position": {
        "x": 220,
        "y": 160
      },
      "dimensions": {
        "width": 580,
        "height": 190
      },
      "font_size_range": {
        "min": 40,
        "max": 66
      },
      "max_characters": 46,
      "text_color": "#FFFFFF",
      "background_overlay": {
        "enabled": true,
        "color": "#4A7C59",
        "opacity": 0.75
      }
    },
    "content": {
      "position": {
        "x": 220,
        "y": 620
      },
      "dimensions": {
        "width": 780,
        "height": 290
      },
      "font_size_range": {
        "min": 24,
        "max": 34
      },
      "max_characters": 145,
      "line_height": 1.5,
      "text_color": "#FFFFFF",
      "background_overlay": {
        "enabled": true,
        "color": "#8FBC8F",
        "opacity": 0.7
      }
    }
  },
  "color_palette": {
    "primary": "#4A7C59",
    "secondary": "#8FBC8F",
    "accent": "#F0F8FF",
    "background": "#E8F5E8",
    "text_overlay": "#FFFFFF"
  },
  "design_elements": {
    "style": "natural organic elements with earth tones",
    "mood": "balanced, healthy, peaceful",
    "keywords": ["wellness", "nature", "balance", "health", "organic", "natural"],
    "imagery_type": "natural landscapes with plants and water",
    "complexity_level": "moderate"
  },
  "usage_guidelines": {
    "best_times": ["any time", "especially 07:00-19:00"],
    "target_audience": "health-conscious users, wellness enthusiasts",
    "content_types": ["health tips", "wellness advice", "mindfulness content", "nature connection"],
    "avoid_content": ["unhealthy habits", "stress-inducing content", "artificial themes"]
  },
  "accessibility": {
    "color_contrast_ratio": 5.4,
    "text_readability": "excellent",
    "mobile_optimized": true,
    "screen_reader_friendly": true
  },
  "created_date": "2024-01-15T12:00:00Z",
  "last_modified": "2024-01-15T12:00:00Z",
  "version": "v1.0.0",
  "created_by": "Design Team",
  "approved_by": "Product Manager",
  "status": "approved"
}